month_day,label,old_testament,new_testament,psalm,proverbs,what_now_1,what_now_2
0101,"January 1","GENESIS 1:1-2:25","MATTHEW 1:1-2:12","PSALM 1:1-1:6","PROVERBS 1:1-1:6","Happy New Year! Click Share if today marks the start of your year long journey of reading through the Bible, a spiritual journey that will impact the way you live your life. Share this post with your friends and encourage them to read through the Bible together! Ready? Lets GO! Heb 12:1 (GNT) '... let us rid ourselves of everything that gets in the way, and of the sin which holds on to us so tightly, and let us run with determination the race that lies before us.'","In the beginning God..."
0102,"January 2","GENESIS 3:1-4:26","MATTHEW 2:13-3:6","PSALM 2:1-2:12","PROVERBS 1:7-1:9","Do you see the impact of the fall in the world today? How is Satan attempting to use the same methods of deceit described in Genesis 3 in your own life today?","The fear of the Lord is the beginning of knowledge: but fools despise wisdom and instruction. ~ Proverbs 1:7 (KJV)"
0103,"January 3","GENESIS 5:1-7:24","MATTHEW 3:7-4:11","PSALM 3:1-8","PROVERBS 1:10-19","In what ways does our society today resemble that of Noah's time?","If God were looking for one righteous person today, would He look to you? How can you adjust your actions and/or attitudes to reflect God's righteousness?"
0104,"January 4","GENESIS 8:1-10:32","MATTHEW 4:12-25","PSALM 4:1-8","PROVERBS 1:20-23","When Jesus calls out 'Come, follow me' in Matthew 4:18-22, the disciples are quick to respond. Simon and Andrew leave their nets 'at once' to follow him, James and John also follow him immediately, 'leaving the boat and their father behind.' How do you respond when you sense the prompting of the Spirit? Do you drop your nets and follow or do you make excuses?","The Psalmist often cries out to God in frustration and desperation. Do your prayers reveal that level of openness and honesty?"
0105,"January 5","GENESIS 11:1-13:4","MATTHEW 5:1-26","PSALM 5:1-12","PROVERBS 1:24-28","Praise God for the moments in your life when he has blessed your path because you heeded his directions.","Is God calling you to take a leap of faith like Abram?"
0106,"January 6","GENESIS 13:5-15:21","MATTHEW 5:27-48","PSALM 6:1-10","PROVERBS 1:29-33","Does Jesus' teaching in the Sermon on the Mount convict you for living by the letter of the law (thou shall not kill) and ignoring the Spirit of the Law (thou shall not hate)? What steps can you take to better embrace the Spirit of the Law?","Consider Abram's honesty with God in Genesis 15, is your relationship with God such that you can honestly share your heart?"
0107,"January 7","GENESIS 16:1-18:15","MATTHEW 6:1-24","PSALM 7:1-17","PROVERBS 2:1-5","Today marks our first week thru the Bible this year. If you've missed any readings do not be discouraged, know this is common for many people. The important thing is to be in God's word, not to be a slave to the schedule. So if you are behind, read today's readings and be encouraged. - Phil 3:12 (CEV) - I have not yet reached my goal, and I am not perfect. But Christ has taken hold of me. So I keep on running...","Abram trusted Sarai's plan over God's long-range plan. In what areas are you tempted to short-cut God's plans for your life?"
0108,"January 8","GENESIS 18:16-19:38","MATTHEW 6:25-7:14","PSALM 8:1-9","PROVERBS 2:6-15","Abraham's interaction with God concerning Sodom and Gomorrah points to the value of praying for others. Who needs your intercessional prayer today?","'So don't worry about tomorrow, for tomorrow will bring its own worries. Today's trouble is enough for today.' ~ Matthew 6:34 (NLT) Biblical Truth: It serves no purpose to be preoccupied with what might happen, so don't worry about tomorrow; let God be God in your life today."
0109,"January 9","GENESIS 20:1-22:24","MATTHEW 7:15-29","PSALM 9:1-12","PROVERBS 2:16-22","Again, Abraham lies about Sarah being his sister. This story reveals the tendency of people toward specific sins. Is there a temptation that snares you most regularly? Ask for God's forgiveness and assistance in avoiding those temptations.","When we are willing to surrender that which is most dear to us to serve our Heavenly Father we demonstrate our love and worship to Him."
0110,"January 10","GENESIS 23:1-24:51","MATTHEW 8:1-17","PSALM 9:13-20","PROVERBS 3:1-6","The love story of Isaac and Rebekah is even more powerful when we consider the hand of God working to bring the two together through the prayer of Abraham's servant. Celebrate God's providential work in bringing you into your current situation.","Trust in the Lord with all your heart; do not depend on your own understanding. Seek his will in all you do, and he will show you which path to take. ~ Proverbs 3:5-6 NLT"
0111,"January 11","GENESIS 24:52-26:16","MATTHEW 8:18-34","PSALM 10:1-15","PROVERBS 3:7-8","Christ answers the prayers of those that call Him Lord. He is able to calm our fear and strengthen our faith in the most turbulent circumstance.","Some offered Jesus excuses while others followed. Are there excuses holding you back from fully following Christ in faith?"
0112,"January 12","GENESIS 26:17-27:46","MATTHEW 9:1-17","PSALM 10:16-18","PROVERBS 3:9-10","The patriarchs often built altars to commemorate God moments in their life, what God moments do you need to commemorate?","Jesus asked, 'Why do you entertain evil thoughts in your hearts?' (Matthew 9:4) Are you convicted by this question?"
0113,"January 13","GENESIS 28:1-29:35","MATTHEW 9:18-38","PSALM 11:1-7","PROVERBS 3:11-12","Pray that God would raise up workers for the harvest in your city.","'The girl is not dead, but asleep.' (Matthew 9:24) Jesus calls you to believe the unbelievable... to trust Him when life is at its worst... Are you having trouble believing the unbelievable in your life?"
0114,"January 14","GENESIS 30:1-31:16","MATTHEW 10:1-23","PSALM 12:1-8","PROVERBS 3:13-15","After Jesus asked His disciples to pray for workers for the harvest, He sends them to the harvest field. Where has Jesus sent you? How are you harvesting in your sphere of influence: your job, your school, your family, etc.?","Wisdom is more valuable than jewels; nothing you could want can compare with it. ~ Proverbs 3:15 GNT"
0115,"January 15","GENESIS 31:17-32:12","MATTHEW 10:24-11:6","PSALM 13:1-6","PROVERBS 3:16-18","Whoever acknowledges me before others, I will also acknowledge before my Father in heaven. But whoever disowns me before others, I will disown before my Father in heaven. ~ Matthew 10:32-33 (NIV)","No matter what man's opinion of us is, we are valuable in the sight of God, who can silence all fears | Source: Fearful to Fearless."
0116,"January 16","GENESIS 32:13-34:31","MATTHEW 11:7-30","PSALM 14:1-7","PROVERBS 3:19-20","El Elohe Israel - Mighty is the God of Israel! When you are weary remember, the God of Israel is your Mighty God, too!","How are your wrestling skills? Jacob would not let go of God until he received a blessing. Are you willing to hold on to God with that sort of fervor? Do you have any scars, like Jacob's limp, from holding on to God? Share the story of your scars with someone today who needs encouragement in their faith."
0117,"January 17","GENESIS 35:1-36:43","MATTHEW 12:1-21","PSALM 15:1-5","PROVERBS 3:21-26","In psalm 15 the Psalmist describes several characteristics of those whose walk is blameless. Use those characteristics as a self-test. (Are you righteous? Do you speak the truth? Do you slander? etc.) In those areas where your actions are not blameless ask for God's forgiveness and help.","Wisdom guides us through life, keeps us from temptation so that we can walk in confidence and without fear. We are protected by the one that never sleeps."
0118,"January 18","GENESIS 37:1-38:30","MATTHEW 12:22-45","PSALM 16:1-11","PROVERBS 3:27-32","Jesus condemns the Pharisees for their lack of fruit and warns that man will be held accountable for every word they speak. How will your words stand up to the scrutiny of God's judgment?","Praise God today for the moments that he has been your refuge."
0119,"January 19","GENESIS 39:1-41:16","MATTHEW 12:46-13:23","PSALM 17:1-15","PROVERBS 3:33-35","Are you cultivating the seeds that God places in your life?","Joseph languished in prison for two more years due to the forgetfulness of the cupbearer. Are you currently waiting on God? Remember Joseph's example of patience in the prison and more importantly, remember God's faithfulness!"
0120,"January 20","GENESIS 41:17-42:17","MATTHEW 13:24-46","PSALM 18:1-15","PROVERBS 4:1-6","Joseph's brothers display a growing guilt in this week's readings. Are you being tormented with guilt?","A small amount of faith can develop beyond all expectation. How is God stretching your faith?"
0121,"January 21","GENESIS 42:18-43:34","MATTHEW 13:47-14:12","PSALM 18:16-36","PROVERBS 4:7-10","Once we are caught in the shadow of guilt we can only escape it through the blood of Christ! Do you have unconfessed sin you need to bring to God today?","Does your life reflect the pursuit of wisdom? What can you do to grow in wisdom?"
0122,"January 22","GENESIS 44:1-45:28","MATTHEW 14:13-36","PSALM 18:37-50","PROVERBS 4:11-13","Joseph forgave, in the power of God's mercy. Is there someone desperately longing for your forgiveness today?","But Jesus spoke to them at once. Don't be afraid, he said. Take courage. I am here! ~ Matthew 14:26-27 (NLT) --- The more we know Christ the more we trust Him. The storms of fear are silenced because Christ is near."
0123,"January 23","GENESIS 46:1-47:31","MATTHEW 15:1-28","PSALM 19:1-14","PROVERBS 4:14-19","'May the words of my mouth and the meditation of my heart be pleasing in your sight, O Lord, my Rock and my Redeemer.' (Psalm 19:14) Ask the Holy Spirit to watch your words and thoughts closely and reveal those that are not pleasing to the Father.","Joseph is reunited with his father. The New Testament speaks of a day of joyous reunion as well, the day of Christ's return."
0124,"January 24","GENESIS 48:1-49:33","MATTHEW 15:29-16:12","PSALM 20:1-9","PROVERBS 4:20-27","Jesus repeatedly says to the disciples, 'You of little faith.' (Matthew 16:8) How would Jesus describe your faith?","Jacob blesses his sons... fathers and grandfathers... how can you bestow a blessing on your descendants today?"
0125,"January 25","GENESIS 50:1-26","EXODUS 1:1-2:10","MATTHEW 16:13-17:9","PSALM 21:1-13","What a comfort it is that Christ is nearby, that through His word and touch of grace He is able to remove the clouds of fear. -- While Peter was still speaking, the shadow of a bright cloud passed over them. From the cloud a voice said, 'This is my own dear Son, and I am pleased with him. Listen to what he says!' When the disciples heard the voice, they were so afraid that they fell flat on the ground. But Jesus came over and touched them. He said, 'Get up and don't be afraid!' ~ Matthew 17:5-7 (CEV)","Are you willing to die to self each day and give up everything for Jesus? What is He calling you to surrender today? -- 'Then said Jesus unto his disciples, If any man will come after me, let him deny himself, and take up his cross, and follow me. For whosoever will save his life shall lose it: and whosoever will lose his life for my sake shall find it.' ~ Matthew 16:24-25 (KJV)"
0126,"January 26","EXODUS 2:11-3:22","MATTHEW 17:10-27","PSALM 22:1-18","PROVERBS 5:7-14","Today's selection from the book of Proverbs begs the question; 'Is it worth it?' Are the things that command your time, talent and energy really worth it? -- The Message paraphrases it like this: You don't want to end your life full of regrets, nothing but sin and bones, Saying, 'Oh, why didn't I do what they told me? Why did I reject a disciplined life? Why didn't I listen to my mentors, or take my teachers seriously? My life is ruined! I haven't one blessed thing to show for my life!'","How have you seen mountains move as a result of faith the size of a mustard seed?"
0127,"January 27","EXODUS 4:1-5:21","MATTHEW 18:1-20","PSALM 22:19-31","PROVERBS 5:15-21","When Moses made excuses to God, God said 'What is that in your hand?' -- It's easy to list the things we cannot do for God, but the better question is What has He given you that you can and must use for His Kingdom? -- Now Go! Pick up your staff! And know that God is with you!","Then he said, I tell you the truth, unless you turn from your sins and become like little children, you will never get into the Kingdom of Heaven. So anyone who becomes as humble as this little child is the greatest in the Kingdom of Heaven. ~ Matthew 18:3-4 NLT"
0128,"January 28","EXODUS 5:22-7:25","MATTHEW 18:21-19:12","PSALM 23:1-6","PROVERBS 5:22-23","The parable of the unmerciful servant reveals someone that has forgotten the grace they received. Give thanks to God for mercies He has shown you and you may find it easier to display mercy to others.","I may walk through valleys as dark as death, but I won't be afraid. You are with me, and your shepherd's rod makes me feel safe. ~ Psalm 23:4 (CEV) - Biblical Truth: Christ is our shepherd providing comfort to His flock, He protects and guides us through the darkest times. We have nothing to fear because nothing can separate us from God?s love. #fearnot"
0129,"January 29","EXODUS 8:1-9:35","MATTHEW 19:13-30","PSALM 24:1-10","PROVERBS 6:1-5","God protected the land of Goshen where the Israelites resided. Spend time recalling the times you have experienced His protection... take a moment to share one of them with a friend or co-worker.","The earth and all within it are the property of God. Praise him for His dominion over all things."
0130,"January 30","EXODUS 10:1-12:13","MATTHEW 20:1-28","PSALM 25:1-15","PROVERBS 6:6-11","Pharaoh waivers back and forth between submission and arrogance. This same battle rages within each of us. Submit yourself to the Lord and repent of the arrogance in your life","The Passover lamb foreshadows the culmination of God's redemptive plan of Christ and the cross; Praise God today for His Passover Lamb!"
0131,"January 31","EXODUS 12:14-13:16","MATTHEW 20:29-21:22","PSALM 25:16-22","PROVERBS 6:12-15","Proverbs warns against deceit and dissension, pray that God would cleanse your heart of these as both will demolish the church and the witness of the body.","We are completing 1/12 of our journey through the Bible today. Keep your eyes fixed on Jesus and if you've missed some readings don't worry, stay in His Word and spring forward to todays readings. - Encourage your friends by letting them know what being in the Word each day has meant to you! -- 'Let us keep our eyes fixed on Jesus, on whom our faith depends from beginning to end. He did not give up because of the cross! On the contrary, because of the joy that was waiting for him, he thought nothing of the disgrace of dying on the cross, and he is now seated at the right side of God's throne.' ~ Hebrews 12:2 (GNT)"
0201,"February 1","EXODUS 13:17-15:18","MATTHEW 21:23-46","PSALM 26:1-12","PROVERBS 6:16-19","But Moses told the people, 'Don't be afraid. Just stand still and watch the LORD rescue you today. The Egyptians you see today will never be seen again.' ~ Exodus 14:13 (NLT) -- In times of difficulty keep your spirits calm so that you may be prepared to follow God's lead in doing His work... as well as your own.","God did not allow Israel to take the shorter route because He knew they would face battles. Think back and thank God for the times in your life you avoided pitfalls because He took you the long way!"
0202,"February 2","EXODUS 15:19-17:7","MATTHEW 22:1-33","PSALM 27:1-6","PROVERBS 6:20-26","Israel quickly forgets God's gifts and grumbles about their circumstances. Their short memories seem so obvious to us... Have you forgotten blessings and complaining today?","God's provision for Israel might not have been fancy, but it met their needs. Give thanks for God's provision in your life!"
0203,"February 3","EXODUS 17:8-19:15","MATTHEW 22:34-23:12","PSALM 27:7-14","PROVERBS 6:27-35","Joshua led the ground attack while Moses led the spiritual attack. Are you covering the ground troops with spiritual protection in your prayers? -- Share this post with your facebook friends and ask that they join you in praying for those on the front lines... pastors, missionaries, ministry leaders, etc.","Jesus rebukes the Pharisees for making their faith a public performance. Does your public life reflect your private life? Is your private life a reflection of your public life?"
0204,"February 4","EXODUS 19:16-21:21","MATTHEW 23:13-39","PSALM 28:1-9","PROVERBS 7:1-5","God's laws reveal His character and nature, they also reveal His expectations for righteousness. The Ten Commandments point us toward the Redemption of God in Jesus Christ, the perfect sacrifice for imperfect sinners. Thank God today for His law and His gift!","The Lord is my strength and shield. I trust him with all my heart. He helps me, and my heart is filled with joy. I burst out in songs of thanksgiving. ~ Psalm 28:7 (NLT)"
0205,"February 5","EXODUS 21:22-23:13","MATTHEW 24:1-28","PSALM 29:1-11","PROVERBS 7:6-23","The reading from Proverbs reveals the subtle temptation of seduction. Make a list of the areas you are tempted and pray that God protects your path against them.","This is an amazing video of the Kimyal Tribe of Papua, Indonesia celebrating the arrival of the New Testament Bible in the Kimyal language. -- Do you treasure His word like the Kimyal tribe does? 'And the Good News about the Kingdom will be preached throughout the whole world, so that all nations will hear it, and then the end will come' ~ Matthew 24:14 (NLT)"
0206,"February 6","EXODUS 23:14-25:40","MATTHEW 24:29-51","PSALM 30:1-12","PROVERBS 7:24-27","Praise God for the moments that He has lifted you from the depths.","Are you being a good steward of what God has given you as you await His return? How can you use your time, talent and treasure to honor Him?"
0207,"February 7","EXODUS 26:1-27:21","MATTHEW 25:1-30","PSALM 31:1-8","PROVERBS 8:1-11","The parable of the virgins is a reminder for us to be prepared for the return of Christ. Does your life display preparedness? Are there things you can do in order to keep the imminent return of Christ on your consciousness?","His lord said to him, 'Well done, good and faithful servant; you were faithful over a few things, I will make you ruler over many things. Enter into the joy of your lord.' -- The parable of the talents in todays reading of Matthew 25 reminds me of the Paul Baloche song titled 'My Reward'"
0208,"February 8","EXODUS 28:1-43","MATTHEW 25:31-26:13","PSALM 31:9-18","PROVERBS 8:12-13","What could you do for 'the least of these'?","Are you in distress like the psalmist? Pray today's reading from Psalm 31; if not... pray it for someone you know who is hurting."
0209,"February 9","EXODUS 29:1-30:10","MATTHEW 26:14-46","PSALM 31:19-24","PROVERBS 8:14-26","Scholars have many theories on why Judas betrayed Jesus. Some assume that Judas was God's pawn, others think Judas was frustrated because Jesus would not lead an earthly revolution, still others believe Judas was upset about the use of funds. The latter options indicate that Jesus wasn't who Judas expected. Do you betray Jesus when your expectations of Him differ from His revelation of Himself?","Notice the connection between the blood of the old Testament sacrifice displayed in Aaron's purification with the words Jesus used to introduce the Lord's Supper. 'This is my blood of the covenant.' Give thanks for the blood that Jesus shed that purifies us from sin!"
0210,"February 10","EXODUS 30:11-31:18","MATTHEW 26:47-68","PSALM 32:1-11","PROVERBS 8:27-32","David records the joy of God's forgiveness in Psalm 32. If your bones are wasting away with guilt, accept the grace God extends. Celebrate his forgiveness today!","Peter drew his sword to face the mob and once again Jesus rebukes him. Sometimes it is difficult to know when to act and when to keep still. Ask God for wisdom and help in recognizing the difference."
0211,"February 11","EXODUS 32:1-33:23","MATTHEW 26:69-27:14","PSALM 33:1-11","PROVERBS 8:33-36","Peter goes from drawing his sword to denying His Lord! Consider instances when you made the same slippery slide and give thanks to God for His forgiveness.","The voice that spoke the world into existence silently accepted the punishment for our sins. Praise God that the voice of creation will also welcome you into eternity through the sacrifice of the Son."
0212,"February 12","EXODUS 34:1-35:9","MATTHEW 27:15-31","PSALM 33:12-22","PROVERBS 9:1-6","Moses descended the mountain with his face glowing with the glory of God! Does your faith walk reflect the glory of God?","Some of the same people who clamored for Christ's execution had shouted His hosannas earlier in the week. How could people change their tune so quickly?"
0213,"February 13","EXODUS 35:10-36:38","MATTHEW 27:32-66","PSALM 34:1-10","PROVERBS 9:7-8","God calls for those skilled in construction to participate in the process of constructing the tabernacle. The community of God needs all the skills, talents and abilities that He has provided for the Body. How are you using your skills and talents for the Kingdom?","It is important to remember that even though Pilate and the Jewish leaders seem to play powerful roles, their roles were directed by the All-Knowing Author! Ask God to remind you of His activity in the world when things seem out of control.v"
0214,"February 14","EXODUS 37:1-38:31","MATTHEW 28:1-20","PSALM 34:11-22","PROVERBS 9:9-10","The passage in Matthew provides our foundation and our mission: 1) Our foundation is an empty tomb that reveals that death is defeated and God is All-Powerful! 2) Mt 28:18-20 reveals the Great Commission to make disciples of our Master!","Then Jesus said to them, 'Do not be afraid. Go and tell my brothers to go to Galilee; there they will see me.' ~ Matthew 28:10 (NIV) -- The resurrection of Christ silences fear and fills us with hope and joy. Now go out and proclaim it!"
0215,"February 15","EXODUS 39:1-40:38","MARK 1:1-28","PSALM 35:1-16","PROVERBS 9:11-12","Mark wants his readers to recognize that Jesus is the Christ, the Son of the Living God. As you read Mark's gospel, ask God to imprint you with an accurate understanding of Jesus.","The Israelites were completely dependent on God in the desert. They moved when He moved, they stopped when He stopped. Pray that God would help you recognize and practice the same dependence on Him."
0216,"February 16","LEVITICUS 1:1-3:17","MARK 1:29-2:12","PSALM 35:17-28","PROVERBS 9:13-18","As you read Leviticus, look beyond the letter of the law to discover the Spirit of the Law to see what it reveals about God. Understand that no one can live up to the law in its entirety, and that it foreshadows the grace of God that is revealed in Christ. Ask God for a better understanding of grace as you read the book of Leviticus.","Jesus practiced the discipline of spending time alone with God. How can you follow his example?"
0217,"February 17","LEVITICUS 4:1-5:19","MARK 2:13-3:6","PSALM 36:1-12","PROVERBS 10:1-2","'The Sabbath was made for man, not man for the Sabbath.' (Mark 2:27) God desires a relationship over ritual. Is your faith focused on ritual or on a relationship with God?","In their zeal to protect their religion from impurity the Pharisees rejected Jesus. Ironically He was not 'pure' enough for them. Are there ways in which you protect the purity of your religion at the expense of a relationship with Jesus?"
0218,"February 18","LEVITICUS 6:1-7:27","MARK 3:7-30","PSALM 37:1-11","PROVERBS 10:3-4","Don't give in to worry or anger; it only leads to trouble. Those who trust in the Lord will possess the land, but the wicked will be driven out. ~ Psalm 37:8-9 (GNT) -- When we give in to anger and worry over the prosperity of those who do evil we open ourselves up to temptation. The actions of the wicked are costly and judgment is certain.","Some read Psalm 37:4 and assume that God will give them anything they want. Instead... the words of the Psalmist reveal that God changes our desires to match His desires. Where do you see God actively working to adjust your desires to match His heart?"
0219,"February 19","LEVITICUS 7:28-9:6","MARK 3:31-4:25","PSALM 37:12-29","PROVERBS 10:5","'With the measure you use, it will be measured to you' (Mark 4:24) ~ How we treat others has a direct impact on the way God treats us. Based on that revelation, do you need to adjust your treatment of others?","Are there things that are preventing the Word of God from finding fertile ground in your heart? If you are just reading the Bible in order to check an item off your to-do list... STOP NOW! God wants to transform your life through the reading of His Word. Let the Word bear fruit in your life!"
0220,"February 20","LEVITICUS 9:7-10:20","MARK 4:26-5:20","PSALM 37:30-40","PROVERBS 10:6-7","Israel was overwhelmed by the presence of God; How is God overwhelming you?","'Teacher, don't you care if we drown?' (Mark 4:38) The pleas of the disciples rose over the roar of the sea. When have you asked the question, 'Jesus, don't you care if I drown?' Reflect on the ways that Jesus revealed His presence in those times."
0221,"February 21","LEVITICUS 11:1-12:8","MARK 5:21-43","PSALM 38:1-22","PROVERBS 10:8-9","Two desperate figures from two different walks of life come to Jesus for healing. Jesus works in both lives without distinction of income or status. God is always more concerned with the heart! Do you allow stereotyping to hamper your response to others?","Proverb 10:8 reminds us of the wisdom of listening. How can you stop the 'chatter' long enough to hear the wisdom others speak into your life?"
