month_day,label,old_testament,new_testament,psalm,proverbs,what_now_1,what_now_2
0418,"April 18","JOSHUA 16:1-18:28","LUKE 19:1-27","PSALM 87:1-7","PROVERBS 13:11","The parable of the minas indicates that we must be willing to trust God enough to take risks. The third servant is rebuked for maintaining the status quo and failing to increase the investment he received. How is God calling you to invest what He has given you?","The story of Zacchaeus is often relegated to the children's department, but it reminds adults of the grace of God and the extravagant response of the forgiven sinner."
0419,"April 19","JOSHUA 19:1-20:9","LUKE 19:28-48","PSALM 88:1-18","PROVERBS 13:12-14","The provision for cities of refuge reveals God's desire to protect His people by providing a means of mercy and justice for those who accidentally took a life. How are you extending God's mercy and justice?","'If they keep quiet, the stones will cry out.' (Luke 19:40) ~ Are the rocks around you crying out to cover your lack of heart-felt worship? Spend time praising God with a favorite hymn or chorus, or better yet, write your own song of praise!"
0420,"April 20","JOSHUA 21:1-22:20","LUKE 20:1-26","PSALM 89:1-13","PROVERBS 13:15-16","When the Reubenites, Gadites and half-tribe of Manasseh built a questionable altar, the rest of Israel rushed to the defense of righteousness. How do you react when you see 'Christians' engaged in questionable behavior? Ask God for courage to confront and rebuke if necessary.","Psalm 89:1a NLT: I will sing of the Lord's unfailing love forever!"
0421,"April 21","JOSHUA 22:21-23:16","LUKE 20:27-47","PSALM 89:14-37","PROVERBS 13:17-19","Make a list of the things that you do to impress the people around you... now make another list of the things you do to impress God.","The Sadducees did not believe in the resurrection and were trying to trick Jesus. Do you allow 'deep theological questions' to derail your faith and obedience? Remember that His ways are not our ways, and that the primary purpose of God's Word is life transformation!"
0422,"April 22","JOSHUA 24:1-33","LUKE 21:1-28","PSALM 89:38-52","PROVERBS 13:20-23","Joshua and Moses both pleaded with the people to honor God with their lives. Are you honoring God with your life?","What are you doing to make sure that your household serves the Lord?"
0423,"April 23","JUDGES 1:1-2:9","LUKE 21:29-22:13","PSALM 90:1-91:16","PROVERBS 13:24-25","Like the warnings of Joshua and Moses in the Old Testament, Jesus offers a warning against dissipation, drunkeness and the anxieties of life. What is weighing on your heart and preventing you from walking with Christ?","Caleb provides an example of boldness as he drives out giants and provides for his family. How can you imitate Caleb's boldness today?"
0424,"April 24","JUDGES 2:10-3:31","LUKE 22:14-34","PSALM 92:1-93:5","PROVERBS 14:1-2","Even in periods of rebellion, God reveals His mercy on Israel by sending judges to win victories and draw Israel back to their God. Thank God for the mercy He has shown you in the midst of rebellion.","Peter was ready to follow Jesus to death. But was Peter ready to follow Jesus in life? Why is it sometimes more difficult to live for Christ than to die for Him?"
0425,"April 25","JUDGES 4:1-5:31","LUKE 22:35-53","PSALM 94:1-23","PROVERBS 14:3-4","The song of Deborah seems to praise righteous leaders who are willing to live for the Kingdom of God. How can you pray for your spiritual leaders today?","Like Peter, we are willing to fight for Jesus. While there are times to fight, there are also times to lay down our swords. Pray that God would help you differentiate between the two."
0426,"April 26","JUDGES 6:1-40","LUKE 22:54-23:12","PSALM 95:1-96:13","PROVERBS 14:5-6","God saw Gideon as a mighty warrior although Gideon's present circumstances screamed the opposite. What does God see in you? If God is calling you to a task that seems out of character, remember God knows you better than you know yourself.","Peter's denial of Jesus challenges us because we often deny our Savior by our words and actions. Have you betrayed God with your words or actions this week? Ask God to forgive you of your betrayal."
0427,"April 27","JUDGES 7:1-8:17","LUKE 23:13-43","PSALM 97:1-98:9","PROVERBS 14:7-8","'...Father, forgive them, for they don't know what they are doing.' (Luke 23:34 NLT) ~ As a follower of Jesus, how can you practice this type of forgiveness?","The thief on the cross tells us its never too late to find Jesus! Have you given up on someone? Pray that God reveal Himself."
0428,"April 28","JUDGES 8:18-9:21","LUKE 23:44-24:12","PSALM 99:1-9","PROVERBS 14:9-10","The disciples initially doubted the resurrection report of the women. How does your life reflect your belief in the resurrection?","'Into your hands I commit my Spirit.' (Luke 23:46) ~ Jesus completed his mission to seek and save the lost. Thank God that your salvation is secured in the completed work of Christ!"
0429,"April 29","JUDGES 9:22-10:18","LUKE 24:13-53","PSALM 100:1-5","PROVERBS 14:11-12","Jesus tells the disciples that they are His witnesses. What sort of witness for the resurrected Jesus have you been this week?","We often navigate life with our own internal GPS. The Proverb warns that our GPS might seem right to us but unless it is calibrated with the Holy Spirit, we will likely veer far off God's course! Ask the Holy Spirit to calibrate your GPS!"
0430,"April 30","JUDGES 11:1-12:15","JOHN 1:1-28","PSALM 101:1-8","PROVERBS 14:13-14","Jesus existed with God before the beginning of time. There has never been a day He didn't exist, nor will there be a day he doesn't exist.","Jephthah overcame the stigma of being the son of a prostitute to lead Israel. Remember that God is more concerned with where you are headed than with where you have been. Are there issues from your past that you allow to hinder your present progress in Christ?"
0501,"May 1","JUDGES 13:1-14:20","JOHN 1:29-51","PSALM 102:1-28","PROVERBS 14:15-16","Without the witness of Andrew, Peter would never have discovered Jesus... Is there a Peter waiting to hear about Jesus from you?","Manoah is not the first parent to ask God for wisdom on raising their child. Parents, ask God for wisdom today. Remember, even adult children need the influence of a Godly parent."
0502,"May 2","JUDGES 15:1-16:31","JOHN 2:1-25","PSALM 103:1-22","PROVERBS 14:17-19","God casts our sin as far as the east is from the west. What confessed sin is the accuser bringing back to your mind today? Remember, confessed sin that is brought back to our mind, is brought by Satan not God.","While Samson destroys many Philistines with his final act, we can only imagine what he could have done without his flaws. What flaws are hindering your effectiveness in the Kingdom of God?"
0503,"May 3","JUDGES 17:1-18:31","JOHN 3:1-21","PSALM 104:1-23","PROVERBS 14:20-21","Micah's mother helped direct him toward idolatry. Parents, are you encouraging your children to follow idols? How can you steer them away from idols?","'For God so loved the world, that he gave his only begotten Son, that whosoever believeth in him should not perish, but have everlasting life.' ~ Perhaps you can quote John 3:16... more importantly, are you living John 3:16? How can the world see the truth of John 3:16 in your life and in your actions?"
0504,"May 4","JUDGES 19:1-20:48","JOHN 3:22-4:3","PSALM 104:24-35","PROVERBS 14:22-24","The tribes of Israel react to the sin of Gibeah. How do you hold fellow believers accountable for their actions?","For the second time in Judges we are told that Israel had no king. The Lord was supposed to be their king, but they refused to honor Him. Does your life reflect that God is your king?"
0505,"May 5","JUDGES 21:1-25","RUTH 1:1-22","JOHN 4:4-42","PSALM 105:1-15","The woman at the well received grace from Jesus. Who do you know that is in need of God's grace today?","'...everyone did as he saw fit.' (Judges 21:25) - this line from Judges is descriptive of our culture. What must you do to break the mold and submit yourself and your family to God?"
0506,"May 6","RUTH 2:1-4:22","JOHN 4:43-54","PSALM 105:16-36","PROVERBS 14:26-27","The man with the sick son 'took Jesus at His word.' (John 4:50) Are there times you have trouble taking Jesus at His Word? Ask God to help you trust Him.","When we turn our concerns over to God we are assured that He will work it for His good. #fearnot #365fearnots"
0507,"May 7","1 SAMUEL 1:1-2:21","JOHN 5:1-23","PSALM 105:37-45","PROVERBS 14:28-29","Hannah battled for her husband's affections with another woman. Men, does your wife battle for your affections with your hobby, career, or other form of 'mistress'? Commit to give your affections fully to your spouse.","If Jesus could accomplish nothing apart from the Father, don't you think you need to remain connected to Him as well? Take a look at your calendar. Do you need to make changes to your calendar in order to remain more connected to the Father?"
0508,"May 8","1 SAMUEL 2:22-4:22","JOHN 5:24-47","PSALM 106:1-12","PROVERBS 14:30-31","'Give thanks to the LORD, for he is good; his love endures forever.' ~ Psalm 106:1. | Thank God for His enduring love!","Pray the prayer of Samuel today; 'Speak, for your servant is listening.' ~ 1 Samuel 3:10"
0509,"May 9","1 SAMUEL 5:1-7:17","JOHN 6:1-21","PSALM 106:13-31","PROVERBS 14:32-33","No idols stand in the presence of God! What idols are interfering with your worship?","Ebenezer means stone of help. Think back to the instances in your life where God has helped you. Give thanks for His past activity, His promises for the future, and let them remind you of His continued presence!"
0510,"May 10","1 SAMUEL 8:1-9:27","JOHN 6:22-42","PSALM 106:32-48","PROVERBS 14:34-35","Peer pressure led the nation of Israel to beg for a king. If we are not careful, God will fulfill our requests. Are you asking God for something that contradicts His plan?","Do you seek miraculous signs as evidence of God's presence? While God works miracles, His activity in the simple things of life is more frequent. Thank God for working in the mundane aspects of your life."
0511,"May 11","1 SAMUEL 10:1-11:15","JOHN 6:43-71","PSALM 107:1-43","PROVERBS 15:1-3","Offer gentle answers to everyone you meet today.","God selected Saul to lead Israel. As we will see in the days to come, Saul is a flawed leader. Yet, God made him king over Israel. We must remember the instructions of the New Testament that we should pray for our political leaders, whether we agree with them politically or not."
0512,"May 12","1 SAMUEL 12:1-13:23","JOHN 7:1-30","PSALM 108:1-13","PROVERBS 15:4","Saul's impatience proved to be his downfall. Is impatience hindering your spiritual growth?","Samuel said that he would not commit the sin of failing to pray for the nation of Israel. (1 Samuel 12:23) - How can you pray for your country?"
0513,"May 13","1 SAMUEL 14:1-52","JOHN 7:31-53","PSALM 109:1-31","PROVERBS 15:5-7","Jonathan shows great courage and confidence in God when he attacks the Philistines. How is God calling you to show courage today?",
0514,"May 14","1 SAMUEL 15:1-16:23","JOHN 8:1-20","PSALM 110:1-7","PROVERBS 15:8-10","Partial obedience is disobedience! God desires obedience over sacrifice and ritual. Are there areas of your life you are living in partial obedience?","Samuel tried to select a king for Israel based on external indicators. How often do we make the same mistake when we interact with others? Ask God to help you see others with His eyes."
0515,"May 15","1 SAMUEL 17:1-18:4","JOHN 8:21-30","PSALM 111:1-10","PROVERBS 15:11","David wasn't motivated by reward or prestige, he wanted to honor God and defend His glory. How will you defend God's glory today?","What giants are taunting you today? God still empowers slingshots!"
0516,"May 16","1 SAMUEL 18:5-19:24","JOHN 8:31-59","PSALM 112:1-10","PROVERBS 15:12-14","Jonathan played the difficult role of mediator. At times we must work to bring about resolution in the hearts of the people around us. Do you need to serve as a mediator today?","Jesus said to the people who believed in him, 'You are truly my disciples if you remain faithful to my teachings. And you will know the truth, and the truth will set you free.' ~ John 8:31-32 (NLT)"
0517,"May 17","1 SAMUEL 20:1-21:15","JOHN 9:1-41","PSALM 113:1-114:8","PROVERBS 15:15-17","Jonathan risked serious repercussions and displayed great integrity by supporting David. How are you showing that same courage and integrity in support of your friends?","Do you praise God from the rising of the sun until it sets? Make a point to pause in the midst of your day today to praise God for His abundant blessings."
0518,"May 18","1 SAMUEL 22:1-23:29","JOHN 10:1-21","PSALM 115:1-18","PROVERBS 15:18-19","While David fled the wrath of Saul, individuals displayed kindness and concern for David's cause. Has someone come to your assistance in recent weeks? Thank God for them and then let them know that their actions are appreciated.","David sought the Lord's wisdom. Are you seeking God's wisdom or have you ventured out on your own wisdom?"
0519,"May 19","1 SAMUEL 24:1-25:44","JOHN 10:22-42","PSALM 116:1-19","PROVERBS 15:20-21","'...no one can snatch them out of my hand. (John 10:28) -- This statement by Jesus is one of the clearest revelations of the eternal security of those who believe in Christ. Praise God that your salvation is centered on Christ's strength and not your own!","Abigail brokered peace between David and Nabal. She prohibited the otherwise inevitable conflict. How is God calling you to be a peacemaker today?"
0520,"May 20","1 SAMUEL 26:1-28:25","JOHN 11:1-54","PSALM 117:1-2","PROVERBS 15:22-23","When the Lord did not answer Saul he turned to witchcraft. Lack of patience will lead us to listen to voices other than God's. When are you tempted to listen to a voice that isn't God's?","Jesus lingers before going to visit His friend Lazarus. While the delay might be considered indifference, it provides a forum for Jesus to work an incredible miracle. When have apparent delays and detours resulted in God's miraculous activity in your life?"
0521,"May 21","1 SAMUEL 29:1-31:13","JOHN 11:55-12:19","PSALM 118:1-18","PROVERBS 15:24-26","While David was living with his enemies (the Philistines), a raiding party captured his family and the familes of his men. In the midst of potential mutiny, David found the strength of God and recovered the captured family members. David's situation provides an example for us in difficult times. How do you turn to God on dark days?","'It is better to take refuge in the Lord than to trust in people.' ~ Psalm 118:8 (NLT)"
0522,"May 22","2 SAMUEL 1:1-2:11","JOHN 12:20-50","PSALM 118:19-29","PROVERBS 15:27-28","When it comes to investing your resources, are you tempted to invest in the enhancement of your earthly life? How can you better invest in eternity?","Even after Saul's death, David continues to seek the Lord's direction. In what areas are you tempted to be overconfident? Continue to seek God's face!"
0523,"May 23","2 SAMUEL 2:12-3:39","JOHN 13:1-30","PSALM 119:1-16","PROVERBS 15:29-30","Joab did not display honor or obedience in the murder of Abner. How is bitterness hindering your ability to honor God's commands?","Do you hide God's word in your heart? Why not begin by memorizing; 'I have hidden your word in my heart, that I might not sin against you.' ~ Psalm 119:11 (NLT)"
0524,"May 24","2 SAMUEL 4:1-6:23","JOHN 13:31-14:14","PSALM 119:17-32","PROVERBS 15:31-32","Even after David became king and experienced success he continued to inquire of the Lord. (2 Samuel 5:23) In what area do you need to seek God's input today? ""","When the journey of life grows wearisome, remember that God is preparing an eternal abode that will eclipse anything on this earth!"
0525,"May 25","2 SAMUEL 7:1-8:18","JOHN 14:15-31","PSALM 119:33-48","PROVERBS 15:33","Sometimes a no from God reveals a hidden yes! David would not build God's Temple, but one of his descendants would. God reveals that David would always have a son on the throne of Israel. Is God providing a hidden yes in what seems like an apparent no in your life?","'Turn my eyes from worthless things, and give me life through your word.' ~ Psalm 119:37 (NLT) -- What 'worthless things' are competing for your attention?"
0526,"May 26","2 SAMUEL 9:1-11:27","JOHN 15:1-27","PSALM 119:49-64","PROVERBS 16:1-3","David wasn't in the right place (at war) when he succumbed to temptation with Bathsheba. Are you opening the door to sin by placing yourself in the 'wrong place'?","David compounds his sin by attempting to cover up the affair. Are you lying to cover up your sin? Come clean today and receive the cleansing available through confession."
0527,"May 27","2 SAMUEL 12:1-31","JOHN 16:1-33","PSALM 119:65-80","PROVERBS 16:4-5","Confronted with his sin; David confessed and sought God's forgiveness. Do you need to seek God's grace today?","God used Nathan to reveal David's sin to the king. God has given us the Holy Spirit. Don't overlook the inner voice of conviction that draws you back to God. What is the Holy Spirit speaking to you about?"
0528,"May 28","2 SAMUEL 13:1-39","JOHN 17:1-26","PSALM 119:81-96","PROVERBS 16:6-7","David handles the rape of Tamar poorly. Though he is angry, he never punishes his son, Amnon. This leads to the rage and eventual rebellion of Absalom. In parenting and in life, we cannot ignore sin and conflict. Ignored sin and conflict will fester and infect. Is there conflict you hope will go away?","Be encouraged that Jesus prayed for your protection in the world. -- 'Holy Father, I am no longer in the world. I am coming to you, but my followers are still in the world. So keep them safe by the power of the name that you have given me. Then they will be one with each other, just as you and I are one.' ~ John 17:11 (CEV)"
0529,"May 29","2 SAMUEL 14:1-15:22","JOHN 18:1-24","PSALM 119:97-112","PROVERBS 16:8-9","Joab modeled peacemaking when he intervened between David and Absalom even though it did not result in restoration. How can you be a peacemaker in your home, on your job, or in the church?","As David flees Jerusalem, he finds some who are loyal and some who turn on him. Can your friends count on your loyalty in times of desperate need?"
0530,"May 30","2 SAMUEL 15:23-16:23","JOHN 18:25-19:22","PSALM 119:113-128","PROVERBS 16:10-11","As Jesus revealed, Pilate is ultimately an instrument of God's grand design. We must remember this as we consider our contemporary political climate. Rulers are ordained by God. Many times we cannot understand why certain leaders achieve power, but we submit ourselves to God's authority as we submit ourselves to their authority! Pray for your earthly leaders today.","David displays great faith and restraint as he departs the city. He entrusts his fate to God. What circumstances in your life currently demand that type of trust on your part?"
0531,"May 31","2 SAMUEL 17:1-29","JOHN 19:23-42","PSALM 119:129-152","PROVERBS 16:12-13","Many people supported David during Absalom's revolt. In desperate times it is important to realize that we are not alone. God has provided a church family and friends to walk with us! Make a list of the people you know that will support you on the darkest days, then be sure to thank them for their friendship.","What irony that Jesus, the Living Water, would cry out, 'I am thirsty.' (John 19:28) There are people around you every day who are thirsting for Living Water. How can you make a delivery?"
0601,"June 1","2 SAMUEL 18:1-19:10","JOHN 20:1-31","PSALM 119:153-176","PROVERBS 16:14-15","The miraculous is always hard to believe, that is the nature of miracles! The resurrection is no different. In spite of Jesus' predictions, the empty tomb baffles the disciples. Do you expect God to work miracles in your life? Expect the unexpected in your walk with Christ!","The book of John was recorded to convince people that Jesus is the Christ. How can your life serve the same purpose?"
0602,"June 2","2 SAMUEL 19:11-20:13","JOHN 21:1-25","PSALM 120:1-7","PROVERBS 16:16-17","Shimei deserved to die. He had disrespected the king and now the king was returning victorious. Yet David will not allow his warrior to end Shimei's life. Extending grace requires much more strength that exacting revenge. How can you imitate David's grace?","Joab jealously eliminates a potential rival in Amasa. Are there individuals that arouse jealousy within you? If so, ask God to help you overcome this jealousy."
0603,"June 3","2 SAMUEL 20:14-21:22","ACTS 1:1-26","PSALM 121:1-8","PROVERBS 16:18","It is not clear whether Mephibosheth side with Absalom or not, but David again spares his life. In what ways does David's treatment of Mephibosheth remind you of God's grace?","Sin always has consequences. The sin of Saul caused Israel to suffer through a famine. Where do you see consequences from sin in your life, in the life of your church, and in the life of your country?"
0604,"June 4","2 SAMUEL 22:1-23:23","ACTS 2:1-47","PSALM 122:1-9","PROVERBS 16:19-20","David's mighty men were renewed in their strength and valor. God needs mighty men and women to carry out His mission today. How can you stand courageously for God?","Peter proclaimed the first truly Christian sermon at Pentecost. Read Peter's words carefully; can you boil down the core message of the Gospel in three or four sentences?"
0605,"June 5","2 SAMUEL 23:24-24:25","ACTS 3:1-26","PSALM 123:1-4","PROVERBS 16:21-23","Concentrate on making your words pleasant today so that you might encourage and instruct those around you.","Who do you know that is longing for times of refreshment? (Acts 3:19) Ask God to give you a heart for those who are suffering from spiritual thirst."
0606,"June 6","1 KINGS 1:1-53","ACTS 4:1-37","PSALM 124:1-8","PROVERBS 16:24","The message of salvation (Acts 4:12) runs contrary to the cultural agenda, but it is the foundational truth of God's Word. Redemption comes through Christ alone!","David did not interfere with Adonijah and correct his misbehavior. Parents, do not assume that misbehaving children will correct themselves. That is your job!"
0607,"June 7","1 KINGS 2:1-3:2","ACTS 5:1-42","PSALM 125:1-5","PROVERBS 16:25","As David prepares for death he gives Solomon a blessing and a challenge. Dads how are you blessing and challenging your sons to walk in the Lord's ways?","After the disciples are arrested they show great boldness by obeying God and returning to the city to proclaim the Good News. Ask God to give you courage to share the gospel and for the ability to find joy in times of persecution."
0608,"June 8","1 KINGS 3:3-4:34","ACTS 6:1-15","PSALM 126:1-6","PROVERBS 16:26-27","Solomon was given great wealth, wisdom and honor. What would you do with those gifts? What are you doing with the talents, treasures and abilities that God has entrusted to you?","Psalm 126 describes the joy of Israel as they returned to the land of promise. Take a few moments today to rejoice in the eternal home that God has promised you."
0609,"June 9","1 KINGS 5:1-6:38","ACTS 7:1-29","PSALM 127:1-5","PROVERBS 16:28-30","What Temple-sized task has God commissioned you to complete? What Temple-sized tasks can you help others complete?","'Psalm 127:1 (NLT): Unless the Lord builds a house, the work of the builders is wasted...' | What are you trying to accomplish using your own strength?"
0610,"June 10","1 KINGS 7:1-51","ACTS 7:30-50","PSALM 128:1-6","PROVERBS 16:31-33","Solomon utilized individuals skilled in craftsmanship to construct the Temple. Are you missing out on opportunities to utilize your own talents for the glory of God!","We are given a hint that something is amiss in Solomon's life. He invested more time on his palace (13 years) than he did on the Temple (11 years). Are you investing more time and energy in your personal interests than in God's Kingdom plans?"
0611,"June 11","1 KINGS 8:1-66","ACTS 7:51-8:13","PSALM 129:1-8","PROVERBS 17:1","Stephen calls his accusers 'stiff-necked.' It took incredible boldness for him to call out his accusers. How can you display that type of boldness in your conversations?","Do you spend so much of your time earning money that you miss out on enjoying life? Write down three things you can do today to enjoy life... then do them!"
0612,"June 12","1 KINGS 9:1-10:29","ACTS 8:14-40","PSALM 130:1-8","PROVERBS 17:2-3","If you, Lord, kept a record of sins, Lord, who could stand? But with you there is forgiveness, so that we can, with reverence, serve you. ~ Psalm 130:3-4 (NIV)","The Ethiopian could not understand the gospel without Philip's help. What can you do to make the Good News more clear to those who don't understand it?"
0613,"June 13","1 KINGS 11:1-12:19","ACTS 9:1-25","PSALM 131:1-3","PROVERBS 17:4-5","Solomon's marriage led him to worship despicable gods. (Molech and Chemosh required child sacrifice!) A small crack in the believer's life can quickly become a giant chasm! Where are you allowing cracks to develop in your spiritual life?","'Saul spent several days with the disciples in Damascus.' (Acts 9:19) While we often think of Paul's conversion as a brief event, we discover that he was discipled over time by other followers of Christ. Is someone discipling you? Who are you discipling?"
0614,"June 14","1 KINGS 12:20-13:34","ACTS 9:26-43","PSALM 132:1-18","PROVERBS 17:6","The man of God spoke boldly against the idolatry of Jeroboam. How is God calling you to speak boldly about idolatry in the lives of those around you?","What does Acts convey to you as you read that the church was 'living in the fear of the Lord.' (Acts 9:31). Does that have any implications for you? For your church?"
